{
  "$schema": "https://json-schema.org/draft/2020-12/schema",
  "type": "object",
  "additionalProperties": false,
  "required": ["schemaVersion", "environment", "sourceRevision", "lockHash", "fixtureHash", "matrix", "diagnostics", "matrixHash"],
  "properties": {
    "schemaVersion": { "const": "1" },
    "environment": {
      "type": "object", "additionalProperties": false,
      "required": ["platform", "arch", "node", "packages", "browsers", "browserExecutables"],
      "properties": {
        "platform": { "type": "string" }, "arch": { "type": "string" }, "node": { "type": "string" },
        "packages": { "type": "object", "additionalProperties": { "type": "string" } },
        "browsers": { "type": "object", "additionalProperties": { "type": "string" } },
        "browserExecutables": {
          "type": "object", "additionalProperties": false,
          "required": ["chromium", "firefox", "webkit"],
          "properties": {
            "chromium": { "$ref": "#/$defs/browserExecutable" },
            "firefox": { "$ref": "#/$defs/browserExecutable" },
            "webkit": { "$ref": "#/$defs/browserExecutable" }
          }
        }
      }
    },
    "ci": {
      "type": "object", "additionalProperties": false,
      "required": ["sourceCommit", "runnerOS", "runnerArch", "imageOS", "imageVersion"],
      "properties": {
        "sourceCommit": { "type": "string", "pattern": "^[a-f0-9]{40}$" },
        "runnerOS": { "const": "Linux" }, "runnerArch": { "const": "X64" },
        "imageOS": { "type": "string", "minLength": 1 },
        "imageVersion": { "type": "string", "minLength": 1 }
      }
    },
    "sourceRevision": { "type": "string", "pattern": "^worktree:[a-f0-9]{64}$" },
    "lockHash": { "type": "string", "pattern": "^[a-f0-9]{64}$" },
    "fixtureHash": { "type": "string", "pattern": "^[a-f0-9]{64}$" },
    "matrix": {
      "type": "object", "additionalProperties": false,
      "required": ["shells", "states", "viewports", "browserProjects", "behaviorChecks", "accessibilityScans", "visualComparisons"],
      "properties": {
        "shells": { "const": 2 }, "states": { "const": 8 }, "viewports": { "const": 3 },
        "browserProjects": { "const": 3 }, "behaviorChecks": { "const": 45 },
        "accessibilityScans": { "const": 144 }, "visualComparisons": { "const": 20 }
      }
    },
    "diagnostics": { "type": "array", "maxItems": 0 },
    "matrixHash": { "type": "string", "pattern": "^[a-f0-9]{64}$" }
  },
  "$defs": {
    "browserExecutable": {
      "type": "object", "additionalProperties": false,
      "required": ["installationPath", "sha256"],
      "properties": {
        "installationPath": { "type": "string", "minLength": 1 },
        "sha256": { "type": "string", "pattern": "^[a-f0-9]{64}$" }
      }
    }
  }
}
