{
  "schemaVersion": "1",
  "environment": {
    "platform": "darwin",
    "arch": "arm64",
    "node": "v24.20.0",
    "packages": {
      "react": "19.2.8",
      "react-dom": "19.2.8",
      "react-router": "8.3.1",
      "react-aria-components": "1.21.1",
      "@playwright/test": "1.63.0",
      "@axe-core/playwright": "4.13.0",
      "axe-core": "4.13.0",
      "@fontsource-variable/inter": "5.3.0"
    },
    "browsers": {
      "chromium": "1243",
      "firefox": "1543",
      "webkit": "2359"
    },
    "browserExecutables": {
      "chromium": {
        "installationPath": "chromium-1243/chrome-mac-arm64/Google Chrome for Testing.app/Contents/MacOS/Google Chrome for Testing",
        "sha256": "8319963f6625accf51c0dd4f55091ceaf9f09ed39e7a52fed4fae12b2a6b668a"
      },
      "firefox": {
        "installationPath": "firefox-1543/firefox/Nightly.app/Contents/MacOS/firefox",
        "sha256": "e75d92f6f3210c9c31056d10b912f43c139f0cf7a2a3d0f2e002e88c1c7fbf5a"
      },
      "webkit": {
        "installationPath": "webkit-2359/pw_run.sh",
        "sha256": "a85baad3d8c07173ac387a59b41500c382b21ed692afe0964d29aac247ccc63b"
      }
    }
  },
  "sourceRevision": "worktree:5187d02f6b6c9c6142f06b3e8b2a8ea6f7f1b0deffb1fd5d5c55010f894242dc",
  "lockHash": "c424b967257bf8344a6283676453d8228ff014a0e08e080d80584a3468d76f07",
  "fixtureHash": "59d40d2da94b5a2d5d0717a055d1602c8ce27783cbcc7a4d15e627ed1f160f66",
  "matrix": {
    "shells": 2,
    "states": 8,
    "viewports": 3,
    "browserProjects": 3,
    "behaviorChecks": 45,
    "accessibilityScans": 144,
    "visualComparisons": 20
  },
  "diagnostics": [],
  "matrixHash": "773a64c4b091b668727617820dbb0043bf411147d333f3d7c14d69fac24b6bdf"
}
